,sentence,index
2794,Then eaten seeds are defecated out in other locations.,279
2800,The bat sends out sound waves from their mouth or nose.,280
2801,The sound waves hit an object.,280
2802,Echoes are produced.,280
2803,The echo returns to the bat's ears.,280
2804,The bat hears the echo.,280
2805,The bat can figure out where the object is located.,280
2810,A bee lands on the flower.,281
2811,Their feet slip into little grooves that hold pollen sacs.,281
2812,"When the bee flies off, it carries off the pollen sac.",281
2813,The bee lands on another plant.,281
2814,The pollen sac falls off and pollinates the plant.,281
2820,Bees land on flowers and eat the nectar of the plants.,282
2821,While on the flowers pollen gets on the bee's fur.,282
2822,The bee flies to another area with other flowers.,282
2823,The pollen is deposited in that area.,282
2824,A plant is able to reproduce.,282
2830,A bee visits a flower.,283
2831,The hairs on the bees legs collect pollen.,283
2832,The bee moves on to a different flower.,283
2833,Some pollen falls off the bee.,283
2834,The flower is pollinated.,283
2840,Some of the rock in the ground is made of limestone.,284
2841,Over long periods of time rain can hit the limestone.,284
2842,And cause a acidic reaction.,284
2843,The limestone will slowly disintegrate.,284
2844,A large gap with be where the limestone was.,284
2845,Result in the cave.,284
2850,Water from the surface seeps below the soil.,285
2851,The water comes into contact with the rock below.,285
2852,The rock over the years carves through the rock.,285
2853,The space in the rock becomes larger and forms into a cave.,285
2854,As more rather rushes through the cave becomes a cavern.,285
2860,An engine must be powered by gas or some fuel source.,286
2861,The fuel source will power an alternator.,286
2862,An alternator will convert mechanical energy in to measurable electrical energy.,286
2863,Electrical energy will be channeled and moved.,286
2864,The electrons will run through to the outlets of the generator.,286
2865,"When you plug something in to the outlets of the generator, a flow of current will conduct electrons.",286
2870,Green is a color that gathers sunlight easily.,287
2871,Sunlight is gathered by the leaves of the plant.,287
2872,The sunlight is broken down into glucose through photosynthesis.,287
2873,The glucose travels the plant.,287
2874,The plant uses that glucose as energy to grow.,287
2880,You breathe air in.,288
2881,Air enters bronchial tubes.,288
2882,Air is then split into the bronchioles of each lung.,288
2883,Bronchioles have alveoli which are tiny air sacs.,288
2884,Alveoli is surrounded by many small blood vessels.,288
2885,Oxygen passes through alveoli into blood vessels.,288
2886,Blood leaves the lungs as it travels through the body.,288
2887,Blood carries carbon dioxide back to the lungs.,288
2888,Carbon dioxide released when you exhale.,288
2890,Air is taken into the body via the nose or mouth.,289
2891,The air travels into the windpipe.,289
2892,The windpipe divides the air to the two lungs via the bronchial tubes.,289
2893,The lungs oxygenate the blood in the body.,289
2894,Carbon dioxide is filtered out by every cell in the body.,289
2895,The carbon dioxide is carried back to the lungs via the bloodstream.,289
2896,The carbon dioxide is exhaled.,289
2900,Air is drawn in through the mouth.,290
2901,The air goes down the esophagus.,290
2902,The air moves into the lungs.,290
2903,The carbon dioxide is removed.,290
2904,The remaining oxygen enters the body.,290
2905,The remaining carbon dioxide is expelled through the mouth.,290
2910,Magma cools inside the crust.,291
2911,Magma crystalizes.,291
2912,Lava cools on the surface.,291
2913,Lava crystalizes.,291
2914,Minerals dissolved in water crystlize.,291
2920,There are places inside Earth where rock will melt.,292
2921,"Melted rock inside the Earth is also called molten rock, or magma.",292
2922,"Magma moves up through Earth's crust, but it does not always reach the surface.",292
2923,"When magma erupts onto Earth's surface, it is known as lava.",292
2924,As lava flows from volcanoes it starts to cool.,292
2925,Minerals form when magma and lava cool.,292
2930,Plants absorb water from the ground through their root systems.,293
2931,"Using sunlight, the plant separates the hydrogen and oxygen molecules through the process of photosynthesis.",293
2932,The plant releases the oxygen into the atmosphere.,293
2933,Combines the hydrogen with carbon dioxide to create an intermediate.,293
2934,The intermediate is used to produce glucose which is the plant's food.,293
2940,Plants create light weight seeds.,294
2941,The wind is able to blow the seeds off of the plants.,294
2942,The wind carries the seeds through the air to other areas.,294
2943,The seeds get caught in the fur of animals.,294
2944,The animals move and lay down on the ground.,294
2945,The seeds get deposited on the ground.,294
2946,The seeds become plants.,294
2950,Plants produce fruit which contain seeds of the plant.,295
2951,An animal eats the fruit from a plant.,295
2952,The animal digests the fruit.,295
2953,The seeds are not digested.,295
2954,The seeds pass through the animal's digestive system.,295
2955,The seeds are in the animal's droppings.,295
2956,The seeds are now in another location and can grow.,295
2960,A plant produces a fruit with seeds in it.,296
2961,An animal eats the fruit.,296
2962,The animal wanders to another area.,296
2963,The animal defecates.,296
2964,The seeds are included in the waste.,296
2965,The seeds produce a new plant.,296
2970,Photovoltaic cells are solar cells.,297
2971,Photovoltaic cell is made from silicon.,297
2972,Sun shines on the solar cells which generates DC electricity.,297
2973,Electricity is fed into an inverter to change it to AC electricity.,297
2974,Electricity is then sent into the home to be used.,297
2975,Extra electricity can be sent to the main power grid for others.,297
2980,Air enters the lungs through bronchial tubes.,298
2981,Air enters bronchioles.,298
2982,Bronchioles have tiny air sacs called alveoli.,298
2983,Alveoli surrounded by small blood vessels.,298
2984,Oxygen absorbed by small blood vessels.,298
2985,Vessels deliver oxygen to every cell in the body.,298
2986,Blood brings carbon dioxide back to lungs.,298
2987,Carbon dioxide released when you exhale.,298
2990,You breathe in.,299
2991,"Air goes through all the little branches in your lungs to fill up the air sacs, or alveoli.",299
2992,Oxygen goes through the walls of the alveoli and into the capillaries.,299
2993,The oxygen goes into the bloodstream.,299
2994,Oxygen is left and carbon dioxide is picked up.,299
2995,You breathe it out through your lungs.,299
3000,Air is brought in through the mouth.,300
3001,Passes through the lungs.,300
3002,And into the bronchial tissue.,300
3003,The carbon dioxide is removed.,300
3004,The lungs bring the oxygen to the rest of the body.,300
3010,Get an ice cube tray.,301
3011,Fill the tray with cool water.,301
3012,Place the tray in the freezer.,301
3013,Leave the tray in the freezer for a few hours.,301
3014,Take they tray out of the freezer.,301
3015,Pop the ice cubes out of tray.,301
3020,You find an empty ice cube tray.,302
3021,You fill the tray with warm water.,302
3022,"You carefully place the tray on an even surface in a freezer that is at least 32 degree Farhenheit, the freezing point of water.",302
3023,The water begins to get colder until it starts to freeze solid.,302
3024,"The water expands as it freezes, one of the few liquids that has greater volume as a solid.",302
3025,"Because you used warm water, the gasses in the water had evaporated out, so you will have nice clear ice cubes without cracks from the trapped gasses.",302
3030,Energy is stored in a battery.,303
3031,The energy is released from the battery as electrical current.,303
3032,The electrical current goes to a motor.,303
3033,The motor makes the needle of the sewing machine go up and down.,303
3034,The needle is pressed through the piece of clothing at a constant rate.,303
3035,Thread is attached and used to stitch the clothing.,303
3040,Coal is burned at a furnace.,304
3041,The resulting heat energy is used to heat water.,304
3042,The heated water is turned into steam.,304
3043,The steam drives a generator.,304
3044,Electricity is produced.,304
3050,Coal is mixed with hot air in a power station.,305
3051,Water is sent through pipes in the power station.,305
3052,The water pipes go through a firebox in the power station.,305
3053,The coal is put in the air in the firebox.,305
3054,The water heats up so it's very hot.,305
3055,The water turns into steam.,305
3056,The steam is pushed out of the pipes into a separate area.,305
3057,The steam powers turbines.,305
3058,Magnets in the turbines spin in wire coils.,305
3059,Electricity is produced.,305
3060,Uranium is underground.,306
3061,Uranium is dug up.,306
3062,Uranium is brought to nuclear power plants.,306
3063,Uranium atoms are split into two smaller atoms.,306
3064,Heat energy is released from the uranium.,306
3065,The heat energy turns water into steam in a nuclear reactor.,306
3066,The steam turns big turbines.,306
3067,The turbines drive generators.,306
3068,The generators make electricity.,306
3069,The steam turns back into water.,306
3070,A nuclear reactor generates heat by nuclear fission.,307
3071,The heat created raises steam.,307
3072,The steam runs through turbines.,307
3073,The turbines generate electricity.,307
3074,The electricity leaves the station.,307
3080,A fuel is heated in an oven.,308
3081,Above the oven is a tank of water that is sealed.,308
3082,The tank of water begins to boil above the oven.,308
3083,A the water boils steam is created.,308
3084,The steam is denser than air so it needs a place to go.,308
3085,The steam is forced out of the tank and into a piston.,308
3086,The piston moves up.,308
3087,The valve of the piston closes.,308
3088,The valve on the next piston opens.,308
3089,"The steam fills the next piston, driving it up, and the other one down.",308
3090,"The flu virus has receptors, which are like viral Velcro, on the surface of the virus particle.",309
3091,"The receptors will lock onto a target cell using these chemical receptors on the surface, which docks onto the cell surface.",309
3092,The receptors  then go into the cell.,309
3093,The receptors use it like a factory.,309
3094,The receptors take it over and make it produce thousands or in some cases millions of copies of new viruses.,309
3095,The copies come streaming out of the cell.,309
3096,"The copies infect other cells to make more viruses, or they escape from the body and infect a new victim.",309
3100,A virus enters a host body.,310
3101,The virus has receptors that lock onto a target cell.,310
3102,The virus enters the cell.,310
3103,The virus uses the cell like a factory to make new copies of the virus.,310
3104,The new copies of the virus leave the cell.,310
3105,Infect other cells.,310
3106,The host gets sick as its cells are damaged.,310
3110,Electromagnet creates magnetic field with electricity.,311
3111,Conductive copper wire is wrapped around a piece of metal.,311
3112,An electric current gets introduced from power source.,311
3113,Flows through the wire.,311
3114,Magnetic field gets created in the wire.,311
3115,And the metal gets magnetized.,311
3116,When turned off it is no longer magnetic.,311
3120,"A conducting metal, like copper, is wrapped around a piece of metal.",312
3121,"An electrical source, like a battery, produces an electrical current.",312
3122,The electrical current flows through the wire.,312
3123,"The electrical current creates a magnetic field around the wire, magnetizing the metal.",312
3124,The magnetic field can be turned on and off by starting or stopping the electricity source.,312
3130,Blood delivers oxygen in the body.,313
3131,Proteins and acids are broken down in the liver.,313
3132,The liver releases waste in the form of urea.,313
3133,The blood carries the urea and carbon dioxide to the kidneys.,313
3134,The kidneys strain the urea and salts needed from the blood.,313
3135,The carbon dioxide by product is transported back to the lungs.,313
3136,Carbon dioxide is exhaled by the lungs.,313
3140,A machine called a pulverizer grinds the coal into a fine powder.,314
3141,"The coal powder mixes with hot air, which helps the coal burn more efficiently, and the mixture moves to the furnace.",314
3142,"The burning coal heats water in a boiler, creating steam.",314
3143,"Steam released from the boiler powers an engine called a turbine, transforming heat energy from burning coal into mechanical energy that spins the turbine engine.",314
3144,"The spinning turbine is used to power a generator, a machine that turns mechanical energy into electric energy.",314
3145,This happens when magnets inside a copper coil in the generator spin.,314
3146,"A condenser cools the steam moving through the turbine. As the steam is condensed, it turns back into water.",314
3147,"The water returns to the boiler, and the cycle begins again.",314
3150,A mold spore floats through the air.,315
3151,The spore lands on a piece of bread.,315
3152,The spore grows hyphae into the bread.,315
3153,The mold forms a colony.,315
3154,Sporangiophores grow upward.,315
3155,The mold sends out spores.,315
3160,A rig drills into the earth where oil is present.,316
3161,A pipe is placed in the hole.,316
3162,A pump is added to the pipe.,316
3163,Oil is pumped out.,316
3164,Oil is placed in barrels.,316
3165,Barrels are loaded on trucks.,316
3166,Trucks go to a refinery.,316
3167,Crude oil is refined to motor oil.,316
3168,Motor oil is bottle.,316
3169,Shipped to gas stations.,316
3170,The oil is extracted either onshore or offshore by large oil rigs.,317
3171,Crude oil is transported to a refinery.,317
3172,The refinery turns the crude oil into gasoline.,317
3173,The gasoline is loaded onto tank trucks.,317
3174,The tank trucks go to gas stations all over the place.,317
3175,The gasoline is delivered to the gas station.,317
3180,The oil needs to be pumped from the ground.,318
3181,After it is pumped it then is transported to a factory.,318
3182,In the factory the oil is processed and turned into fuel.,318
3183,Once the fuel is refined it is then sent to a truck.,318
3184,By truck the fuel is sent to the gas station.,318
3190,Water vapor gets into the atmosphere through a process called evaporation.,319
3191,"This then turns the water that is at the top of oceans, rivers and lakes into water vapor in the atmosphere using energy from the sun.",319
3192,The water vapor rises in the atmosphere and there it cools down.,319
3193,Water vapor rises in the atmosphere and there it cools down and forms tiny water droplets through something called condensation.,319
3194,These then turn into clouds.,319
3195,"When they all combine together, they grow bigger and are too heavy to stay up there in the air.",319
3196,"This is when they will fall to the ground as rain, or maybe snow or hail by gravity.",319
3200,Warm air from the surface rises into the higher cold air.,320
3201,The water vapor in the air is condensed.,320
3202,The condensed water and dust forms a cloud.,320
3203,Wind in the cloud bounces the water droplets around.,320
3204,The bouncing droplets join together.,320
3205,The bigger droplets get heavy.,320
3206,The heavy droplets fall.,320
3207,"As they fall, they join with more moisture in the air.",320
3208,The droplets get larger.,320
3209,Rain falls.,320
3210,Warm water rises off the seas.,321
3211,The water condenses as it cools and gets higher in the air.,321
3212,Then the condensation forms into clouds.,321
3213,The clouds travel over areas on land.,321
3214,The clouds reach a saturation point.,321
3215,The water falls from the clouds.,321
3220,Water evaporates and becomes gaseous.,322
3221,The vapor goes into the air.,322
3222,And the rain becomes clouds in the atmosphere.,322
3223,The clouds become too heavy and it starts to fall.,322
3224,It becomes rain.,322
3230,Items that can be reused are placed into recycling containers.,323
3231,Recycling trucks pick up the items that are able to be reused.,323
3232,The recyclable items travel to a recycling plant.,323
3233,The items are sorted by what they are made of.,323
3234,The items are broken down into small parts.,323
3235,The small parts are melted to make new raw parts.,323
3236,The raw parts are sold to manufactures to make new items.,323
3240,Water in the clouds becomes very cold.,324
3241,The cold water forms ice crystals.,324
3242,The ice crystals grow by absorbing surrounding water droplets.,324
3243,Form snowflakes.,324
3244,The snowflakes fall to the ground.,324
3250,Blood sugar levels increase after a meal.,325
3251,Cells in the pancreas release insulin.,325
3252,Insulin causes the body to absorb glucose from the blood.,325
3253,Blood sugar goes back to normal.,325
3254,Blood sugar is too low.,325
3255,The amount of insulin goes down.,325
3256,Cells in the pancreas release glucagon.,325
3257,The liver turns stored glycogen into glucose.,325
3258,The liver releases the glucose into the blood.,325
3259,Blood sugar goes back to normal.,325
3260,The blood sugar drops in a body.,326
3261,Cells in the pancrease release glucagon.,326
3262,The liver in response turns the glucagon into glucose.,326
3263,And releases it into the blood.,326
3264,The blood sugar levels are restored.,326
3270,Oxygen-depleted blood enters the heart on the right atrium.,327
3271,The atrium contracts.,327
3272,Blood flows from your right atrium into your right ventricle through the open tricuspid valve.,327
3273,"When the ventricle is full, the tricuspid valve shuts.",327
3274,The ventricle contracts.,327
3275,"Blood leaves the heart through the pulmonic valve, into the pulmonary artery and to the lungs.",327
3276,The lungs oxygenate the blood.,327
3277,The oxygenated blood goes into the left atrium.,327
3278,The left atrium sends the blood throughout the body.,327
3280,The outer ear collects sound waves.,328
3281,The sound waves travel from the outer ear to the middle ear.,328
3282,The eardrum changes the sound waves into vibrations.,328
3283,"The hammer, anvil, and stirrup bones vibrate.",328
3284,The sound moves to the inner ear.,328
3285,The sound enters the liquid-filled cochlea.,328
3286,The cochlea vibrates.,328
3287,Small hairs in the cochlea move.,328
3288,Nerve signals are created.,328
3289,The brain understands the nerve signals as sound.,328
3290,Sound enters the ears of a person.,329
3291,The sound hits a drum that is inside the ear.,329
3292,The drum inside the ear converts the sound to electrical impulses.,329
3293,The electrical impulses are sent to the brain.,329
3294,The brain can decode the impulses into sound.,329
3300,Visible light enters through the lens.,330
3301,The light enters into the retina.,330
3302,The light is absorbed by photoreceptor cells.,330
3303,Which is turned into chemical energy.,330
3304,The resulting information is interpreted by the brain as an image.,330
3310,The cornea and lens refract light into a small image.,331
3311,Shine it on the retina.,331
3312,The retina's rods and cones convert it to electrical pulses.,331
3313,The optic nerve carries electrical pulses through the optic canal.,331
3314,Nerve fibers end in the lateral geniculate nucleus and the visual cortex.,331
3320,"The saliva breaks down the chemicals in the food a bit, which helps make the food mushy and easy to swallow.",332
3321,"Your tongue helps out, pushing the food around while you chew with your teeth.",332
3322,The esophagus moves food from the back of your throat to your stomach.,332
3323,Strong muscles in the walls of the stomach and gastric juices break down food in your stomach.,332
3324,Your stomach moves the food into the intestines to complete digestion.,332
3330,"When water freezes it becomes 10% bigger, or takes up 10% more space.",333
3331,"As water expands it puts great pressure on the walls of anything containing it, including any rocks which happen to be surrounding it.",333
3332,"The force of the pressure exerted on the rock surrounding it is enough to wedge the walls of the crack farther apart, thus expanding and deepening the crack.",333
3333,Clay expends when wet like ice does.,333
3334,This causes rock to break apart.,333
3335,Some plants like mosses and lichens are capable of growing without soil on bare rock.,333
3336,When they do this their roots penetrate pores and crevices and cause rocks to split apart as the roots force their way down through the rocks.,333
3340,Sediment transport is the movement of solid particles (sediment).,334
3341,"The movement is due to a combination of gravity acting on the sediment, and/or the movement of the fluid in which the sediment is entrained.",334
3342,"Sediment transport occurs in natural systems where the particles are clastic rocks (sand, gravel, boulders, etc.), mud, or clay.",334
3343,"The fluid is air, water, or ice.",334
3344,And the force of gravity acts to move the particles along the sloping surface on which they are resting.,334
3345,"Sediment transport due to fluid motion occurs in rivers, oceans, lakes, seas, and other bodies of water due to currents and tides.",334
3346,Transport is also caused by glaciers as they flow.,334
3350,Sediment becomes loose from the rest of the soil.,335
3351,The sediment rolls down hill towards a river.,335
3352,The heavy items sink to the bottom.,335
3353,The lighter items float on the top and in convection cycles.,335
3354,As the river flows the sediment is moved.,335
3355,The sediment gets dumped through tributaries into lakes and the ocean.,335
3356,The sediment keeps moving around the world in convection currents.,335
3360,Energy builds up in the crust of the earth.,336
3361,The energy causes the fault lines give way.,336
3362,The earth's plates move.,336
3363,The energy radiates outward from the fault in all directions.,336
3364,The seismic waves shake the earth as they move through it.,336
3370,Plates on the Earth's crust move slowly past each other.,337
3371,"As the plates move, they exert a great force.",337
3372,"When the force is large enough, the crust breaks.",337
3373,The stress is released as energy.,337
3374,The energy moves through the Earth in the form of waves.,337
3375,We feel the earthquake.,337
3380,Gases cause pressure beneath the earth.,338
3381,The gases come to a head and push molten magma to the surface.,338
3382,The magma cools.,338
3383,With enough time the pressure builds up greatly.,338
3384,The resulting volcano may explode.,338
3390,Magma rises through cracks in the Earth's crust.,339
3391,The pressure causes plates to move.,339
3392,Magma explodes to the surface.,339
3393,The lava from the eruption cools to form new crust.,339
3394,"After several eruptions, the rock builds up and a volcano forms.",339
3400,Magma is formed when rock melts inside the Earth's crust.,340
3401,Magma rises.,340
3402,Collects inside magma chambers underneath a volcano.,340
3403,Pressure builds in the magma chambers as they fill.,340
3404,Gain energy for eruption.,340
3405,Some of the energy is converted into seismic activity (earthquakes).,340
3406,If the magma building in the volcano is thick and sticky it will trap gases.,340
3407,Results in an explosive eruption when the pressure becomes too intense.,340
3408,If the magma is thin and runs.,340
3409,"The magma results in a low-pressure, slow-moving flow of magma instead of a violent eruption.",340
3410,Air is pulled into the lungs.,341
3411,Oxygen moves from the lungs into the bloodstream.,341
3412,Air is pushed through the vocal chords.,341
3413,A person talks.,341
3414,Other air is pushed out of the lungs into the environment.,341
3420,You inhale.,342
3421,The air enters the mouth and nose.,342
3422,The diaphragm contracts.,342
3423,Air fills all the sacks in the lungs.,342
3424,Oxygen passes through the sacks into capillaries.,342
3425,The blood is passed to the blood in the capillaries.,342
3426,The blood carries the oxygen to the heart.,342
3427,The heart pumps the oxygenated blood to the body.,342
3430,He air we breathe contains oxygen and other gases.,343
3431,"Once in the lungs, oxygen is moved into the bloodstream and carried through your body.",343
3432,"At each cell in your body, oxygen is exchanged for a waste gas called carbon dioxide.",343
3433,Your bloodstream then carries this waste gas back to the lungs where it is removed from the blood stream and then exhaled.,343
3434,"Your lungs and respiratory system automatically perform this vital process, called gas exchange.",343
3440,There is a lot of rain within a short period of time.,344
3441,The ground tries to absorb as much rain water as it can.,344
3442,The ground becomes saturated with rain water and cannot absorb anymore.,344
3443,Water begins flowing above the ground instead of dropping into the soil.,344
3444,"The water carves away land, plants, and trees.",344
3445,It causes destruction as it travels.,344
3450,A magma chamber forms under the ground.,345
3451,As the magma gets pressure it travels upwards.,345
3452,The magma finds the weakest point in the volcano.,345
3453,The magma under pressure erupts through that point.,345
3454,The magma turns to lava in the air and travels down the volcano.,345
3460,Magma rises through surrounding rock.,346
3461,"Gas bubbles form and expand, causing lots of pressure.",346
3462,"This pressure pushes the magma through weak spots in the earth's surface,.",346
3463,Magma flows out as lava.,346
3464,This can happen slowly or in a huge explosion.,346
3470,Water flows by rocks.,347
3471,Chemicals are in the waters.,347
3472,Chemicals react with rocks.,347
3473,Rocks change to a different kind of rock.,347
3474,Oxygen in the air reacts with rocks.,347
3475,Rocks change to a different kind of rock.,347
3480,Water is introduced to carbon dioxide.,348
3481,The water becomes acidic.,348
