,sentence,index
1403,Scavengers tear the body apart and move the bones elsewhere.,140
1404,Wind and rain also scatter the bones further.,140
1405,The bones left behind will weather and become buried by sand and soil.,140
1406,The proteins in the bone are replaced with minerals that are dissolved in the soil.,140
1407,This creates a rock-like substance called a fossil.,140
1408,Water and wind erosion wear away the layers of soil on top of the fossil.,140
1409,This makes discovery of the fossil possible.,140
1410,Suns heat enters atmosphere.,141
1411,Green house gases enter from the earth.,141
1412,Heat is trapped in atmosphere.,141
1413,Different things on earth are hotter.,141
1414,The overall planet is hotter.,141
1420,"Human beings burn fossil fuels (oil, gas, etc.).",142
1421,Carbon dioxide from the burning fossil fuels enter the atmosphere.,142
1422,The make-up of the atmosphere changes.,142
1423,Some energy from the sun cannot escape back through the changed atmosphere.,142
1424,The earth begins to heat because of the extra trapped energy.,142
1425,Human beings cut down trees.,142
1426,Human beings do not re-plant the trees.,142
1427,Trees cannot help take the extra carbon dioxide from the atmosphere.,142
1428,The extra trapped energy starts to change the earth's short term weather.,142
1429,Eventually the long-term climate patterns start to change.,142
1430,Solar radiation reaches Earth's atmosphere.,143
1431,Some is reflected back into space.,143
1432,"The rest of the energy is absorbed by land and oceans, heating the Earth.",143
1433,Heat radiates from Earth to space.,143
1434,Some of this heat is trapped by greenhouse gases in the atmosphere.,143
1435,Human activities such as burning fuel are increasing the amount of greenhouses gases.,143
1436,This causes more heat radiation to stay trapped in our atmosphere.,143
1437,The Earth's temperature rises.,143
1440,Sunlight hits chloroplasts in the plant.,144
1441,The energy from the sunlight causes an enzyme in the plant to break apart the water.,144
1442,"The water breakes into oxygen, hydrogen, and electrons.",144
1443,"Hydrogen, along with electrons energized by light, converts NADP into NADPH.",144
1444,Oxygen diffuses out of the plant as a waste product of photosynthesis.,144
1450,Sunlight strikes the chlorophyll molecules in the plant.,145
1451,Is trapped.,145
1452,Plant also takes in water and carbon dioxide from the environment.,145
1453,The plant forms glucose.,145
1454,The plant releases oxygen into the atmosphere.,145
1460,A utensil or computer is chosen for wording.,146
1461,A paper is chosen to write or type on.,146
1462,You write what you need to on the paper.,146
1463,Put the paper in an evelop.,146
1464,Find a stamp.,146
1465,Find a post office or your own mail box.,146
1466,The letter is mailed.,146
1470,Choose what you want to write your letter on.,147
1471,Think of what you want to say.,147
1472,Write some nice things!.,147
1473,Place the letter into an envelope.,147
1474,Put a stamp on the top right corner of the face of the envelope.,147
1475,Write the address of the recipient on the envelope.,147
1476,Put the envelope in your mailbox.,147
1477,"Raise the flag on your mailbox, indicating to the mailman that you have outgoing mail.",147
1480,Get some paper and pens.,148
1481,Write the letter.,148
1482,Fold the letter.,148
1483,Insert in an envelope.,148
1484,Seal the envelope.,148
1485,Address the outside.,148
1486,Put on a stamp.,148
1487,Mail the letter.,148
1490,Food is taken into the mouth.,149
1491,The food is chewed.,149
1492,Saliva mixes with the food and starts breaking it down.,149
1493,The chewed food travels down the esophagus to the stomach.,149
1494,The stomach secretes acid.,149
1495,Grinds and mixes the food.,149
1496,The food moves to the small intestine.,149
1497,The small intestine uses enzymes to further break down the food.,149
1498,The food passes into the colon.,149
1499,The food is expelled from the body.,149
1500,Food is put into mouth.,150
1501,Food is chewed and mixed with saliva (spit).,150
1502,Food travels down the esophagus (throat).,150
1503,Food travels into the stomach.,150
1504,Acid in the stomach breaks the food down further.,150
1505,Food travels into the small intestine.,150
1506,Nutrients from food are absorbed into the blood stream.,150
1507,Food travels into the large intestine.,150
1508,Most of the remaining material is now waste.,150
1509,The waste is eventually removed from the body.,150
1510,An animal eats a lot of food to fatten up.,151
1511,The animal finds or builds a suitable place to hibernate where they can stay warm and protected.,151
1512,The animal moves into their den.,151
1513,Their heart rate and breathing slow down to conserve energy.,151
1514,They emerge from the den when the weather is warming up again.,151
1520,"Animals eat a lot during good (warm, clear) weather.",152
1521,Animals gain weight.,152
1522,"The season changes to one with bad (cold, snowy) weather.",152
1523,Animals find a place to hibernate.,152
1524,"Animals enter a type of ""sleep"" (hibernation).",152
1525,Body processes slow down.,152
1526,The animal's heart rate and breathing rate slow.,152
1527,The animal loses weight more slowly than usual.,152
1528,The animal is able to survive not eating or drinking without hurting itself.,152
1530,Body temperature rises.,153
1531,The brain tells blood vessels to dilate.,153
1532,The sweat glands become active.,153
1533,Moisture is released from the pores.,153
1534,The moisture evaporates.,153
1535,The evaporation causes cooling.,153
1540,Batteries are put in a flashlight.,154
1541,The flashlight is turned on.,154
1542,Two contact strips touch one another.,154
1543,A circuit is completed between the batteries and the lamp.,154
1544,The lamp in the flashlight begins to glow.,154
1545,The reflector in the flashlight directs the lamp's beam.,154
1546,A straight beam of light is generated.,154
1547,The flashlight is turned off.,154
1548,The circuit is broken.,154
1549,The beam is no longer visible.,154
1550,Energy is created by burning either diesel or petrol in a combustion chamber.,155
1551,The energy is transferred from the pistons moving up and down at high speeds.,155
1552,This piston motion is converted to a rotary motion through the crankshaft and axle.,155
1553,The axle turns the wheels.,155
1554,The car moves forward.,155
1560,A car is filled with gasoline (gas).,156
1561,Someone turns the car on with a key.,156
1562,The car's battery produces a spark (electricity).,156
1563,The spark ignites the gas.,156
1564,The burning gas expands when it encounters air.,156
1565,The expanding air and gas pushes a piston out.,156
1566,The motion of several pistons move the crankshaft.,156
1567,Different parts of the car cause the motion in the crankshaft to cause the wheels to move.,156
1568,The wheels and the car's body can move.,156
1570,Fuel is injected into the chamber.,157
1571,The piston moves upwards.,157
1572,Compresses the fuel.,157
1573,The fuel explodes.,157
1574,Chemical energy becomes thermal energy.,157
1575,The explosion pushes the piston downward.,157
1576,The piston moves upwards again.,157
1577,The spent fuel is ejected.,157
1578,New fuel is injected.,157
1579,The cycle repeats.,157
1580,The moon orbits the earth.,158
1581,The earth orbits the sun.,158
1582,The moon comes between the sun and the earth.,158
1583,The sun is totally blocked.,158
1584,A solar eclipse is occurring.,158
1590,Snow falls in an area for a very long time.,159
1591,The snow builds up for a very long time.,159
1592,The snow starts to become packed very firmly.,159
1593,The snow becomes something that's more like ice.,159
1594,Air pockets in the mass continue to grow smaller.,159
1595,The mass becomes solid and heavy enough to be called a glacier.,159
1596,The glacier moves because of gravity.,159
1600,A frog lays eggs in the water.,160
1601,Tadpoles develop inside of the eggs.,160
1602,The eggs hatch.,160
1603,The tadpoles eat and grow.,160
1604,The tadpoles grow legs and form into frogs.,160
1605,The frogs leave the water.,160
1610,An adult frog spawns eggs in water.,161
1611,These eggs hatch into tadpoles and continue to live in the water.,161
1612,The tadpoles grow developing external gills and a longer tail.,161
1613,The tadpole begins storing food in the tail.,161
1614,The tadpole develops hind legs and lives off food stored in the it's tail.,161
1615,The front legs appear and the tadpole's tail shortens.,161
1616,The tadpole now looks like a young frog.,161
1617,The young frog continues to grow to adulthood.,161
1620,The frog eggs hatch.,162
1621,The tadpole breaks free.,162
1622,"Slowly, the gills disappear over the next 6 weeks.",162
1623,The hind legs begin to form at 8 weeks.,162
1624,The front legs form at 12 weeks.,162
1625,The tail shrinks.,162
1626,The mouth grows larger.,162
1627,The tadpole can live on land as a frog.,162
1630,An adult fish lays eggs.,163
1631,The eggs incubate for a few weeks or months before hatching.,163
1632,The young fish remain where they hatched until they are big enough to venture into the open water.,163
1633,The fish continue to grow.,163
1634,The fish reach adulthood.,163
1635,Reproduce continuing the cycle.,163
1640,Fish start as eggs.,164
1641,The eggs hatch.,164
1642,A larvae emerges.,164
1643,The larvae matures and grows.,164
1644,"The larvae becomes an ""adolescent"" fish (or fry).",164
1645,The adolescent fish grows.,164
1646,"The fish might go through several sub-stages, depend on its species or type.",164
1647,The fish is now a mature adult.,164
1648,The adult fish can lay more eggs.,164
1650,A female fish lays eggs.,165
1651,Larvae hatch from the eggs.,165
1652,The larvae eat and grow.,165
1653,The larvae form into juvenile fish.,165
1654,The juvenile fish grow into adult fish.,165
1655,The adult fish mate.,165
1656,The female fish lays eggs.,165
1660,Two birds meet each other.,166
1661,Egg is produced after fertilziation.,166
1662,Mother sits on egg until it hatches.,166
1663,Bird Hatches.,166
1664,Grows up.,166
1665,Flee the next.,166
1666,Starts family.,166
1667,Dies.,166
1670,A male and female bird mate.,167
1671,The female lays eggs.,167
1672,"The eggs are incubated by the parents, by sitting on them, for weeks.",167
1673,The bird hatches from an egg.,167
1674,The parents feed them as the continue to grow.,167
1675,Develop flight feathers.,167
1676,The parents teach them to fly.,167
1677,After learning to fly they leave the nest to live on their own.,167
1678,The next year they breed beginning the cycle again.,167
1680,A bird lays eggs in a nest.,168
1681,The parent(s) incubate the eggs.,168
1682,The eggs hatch.,168
1683,The mother (and sometimes the father) bird take care of the baby birds.,168
1684,The baby birds grow up and get their flight feathers.,168
1685,The young birds learn to fly and leave the nest.,168
1686,The adult birds find mates and mate.,168
1690,There is a fetus in the womb.,169
1691,They are born and are a baby.,169
1692,The baby grows into a child.,169
1693,Puberty turns the child into an adolescent.,169
1694,The adolescent becomes an adult.,169
1695,An adult becomes an elderly person.,169
1696,The elderly person dies.,169
1700,A man and woman mate.,170
1701,Embryo is created.,170
1702,Embryo grows and develops into a fetus inside the woman's womb.,170
1703,The fetus is born.,170
1704,Begins to grow and develop through infancy and childhood.,170
1705,In the teenage years the human experiences puberty.,170
1706,Reaches sexual maturity.,170
1707,At 18 the human becomes an adult.,170
1708,Adult may procreate continuing the cycle.,170
1710,Humans are born as babies.,171
1711,Babies become infants.,171
1712,Infants become children.,171
1713,Children learn skills.,171
1714,Children become teenagers.,171
1715,Teenagers undergo puberty.,171
1716,Teenagers become adults.,171
1717,Adults have children.,171
1718,Adults become elderly.,171
1719,Elderly humans die.,171
1720,A male and female rabbit mate.,172
1721,The female rabbit becomes pregnant.,172
1722,Baby rabbits form inside of the mother rabbit.,172
1723,The female rabbit gives birth to a litter.,172
1724,The newborn rabbits grow up to become adults.,172
1725,The adult rabbits find mates.,172
1730,Baby rabbits are born alive.,173
1731,Rabbits are (only occasionally) nursed by their mothers.,173
1732,Many of the babies do not survive.,173
1733,Larger and stronger rabbit do manage to survive.,173
1734,Rabbits quickly become able to have babies of their own.,173
1735,The rabbit lifecycle continues.,173
1736,The amount of rabbits stays reasonable because of predators and low survival rates for their young.,173
1740,Plants start off as a seed.,174
1741,The seed germinates.,174
1742,The plant gets nutrition from the environment.,174
1743,The plant grows from the nutrients.,174
1744,The plant produces flowers.,174
1745,The flowers produce fruit.,174
1746,The fruit releases seeds.,174
1747,The seeds become new plants.,174
1748,The original plant dies at some point.,174
1750,A seed or seeds planted into the ground.,175
1751,The seed becomes a seeding and grows with water.,175
1752,The sun.,175
1753,The seeding grows into a mature plant.,175
1754,Becomes a flower.,175
1760,The seed germinates.,176
1761,The plant grows.,176
1762,The plant flowers.,176
1763,Produces fruit.,176
1764,The fruit releases seeds.,176
1765,The plant dies.,176
1770,A seed comes from an adult tree.,177
1771,It sprouts from the soil.,177
1772,"It grows into a small seedling, a tree's infancy.",177
1773,"It grows bigger and becomes a sapling, a juvenile tree.",177
1774,"It reaches maturity, this make take many years depending on the type of tree.",177
1775,The tree will begin to age and decline.,177
1776,Eventually rot and decay after it dies.,177
1780,A seed is planted.,178
1781,The seed becomes a small tree.,178
1782,The small tree becomes larger and grows.,178
1783,Some trees bear fruit.,178
1784,Flowers.,178
1785,After awhile the tree will stop growing.,178
1786,Eventually die.,178
1790,Blood is full of different waste.,179
1791,Blood travels through the body.,179
1792,The blood enters the kidneys.,179
1793,The kidneys filter the blood.,179
1794,The waste is seperated.,179
1795,The urine contains the waste.,179
1796,The urine is expelled from the body.,179
1800,They expand to take the air in .,180
1801,The cells of the lung hold the air.,180
1802,They take in the air and remove the Oxygen.,180
1803,They inflate and all the bad air leaves through the mouth.,180
1804,They do it all over again.,180
1810,You breathe in.,181
1811,Diaphragm and other muscles expand to allow room for your lungs to fill.,181
1812,The air flows into the narrow bronchioles in the lungs.,181
1813,From the bronchioles to the alveoli.,181
1814,The oxygen enters into the bloodstream.,181
1815,Is switched with the carbon dioxide in the bloodstream.,181
1816,The carbon dioxide enters through the alveoli.,181
1817,Through the narrow bronchioles.,181
1818,Into the lungs.,181
1819,The carbon dioxide is exhaled out of the body.,181
1820,Waste builds up in the blood.,182
1821,Blood enters the kidney.,182
1822,Blood passes through nephrons in the kidney.,182
1823,Different kinds of waste are momentarily trapped in the kidney.,182
1824,Cleaned blood flows out of the kidney.,182
1825,Filtered waste accumulates in liquid form (urine).,182
1826,Urine flows out of the kidney into the bladder.,182
1830,Blood is carried into the kidneys by the renal artery.,183
1831,Kidneys filter that blood tiny filters inside the kidneys called nephrons.,183
1832,Remove the waste from the blood.,183
1833,The waste that is collected combines with water to become urine.,183
1834,"As each kidney makes urine, the urine slides down a long tube called the ureter.",183
1835,Collects in the bladder.,183
1836,The filtered blood is sent back into the body.,183
1840,They take in fluids and liquids.,184
1841,They process the fluid.,184
1842,They take out the toxins.,184
1843,Produce urine.,184
1844,Urine is released.,184
1845,The nutrients are returned to the body.,184
1850,Fluid.,185
1851,Waste enters the kidneys.,185
1852,A processing moment in the kidneys let waste and fluid pass.,185
1853,Prevents larger molecules to pass.,185
1854,Fluid goes back to the bloodstream.,185
1855,Bad waste is removed.,185
1856,The final product is turned into urine.,185
1860,The kidneys receive blood from the renal artery.,186
1861,They process it with millions of tiny nephrons.,186
1862,Remove all the waste.,186
1863,The kidneys return the blood back to the body through the renal artery.,186
1864,Send the urine with the waste to the bladder through the ureters.,186
1870,The kidneys receive blood through the renal artery.,187
1871,The blood is passed through the nephrons in the kidneys.,187
1872,The kidneys filter the waste from the blood.,187
1873,The clean blood is circulated out of the kidneys.,187
1874,Excess water and waste is expelled from the kidneys in the form of urine.,187
1880,The liver removes toxins from the blood.,188
1881,Liver also cleans blood that has just been enriched with vitamins and minerals during digestion.,188
1882,Liver processes the good stuff into forms that the rest of the body can use.,188
1883,Waste or stuff your body doesn't need can be carried by bile back into the intestine or into the kidneys.,188
1884,The liver also produces a digestive juice called bile that helps the body absorb fat into the bloodstream.,188
1885,The liver also stores extra carbohydrates as glycogen for the body to use as fuel when needed.,188
1890,Blood is sent to the liver.,189
1891,The liver uses chemicals and proteins to treat the blood.,189
1892,The blood is cleaned.,189
1893,Energy is produced.,189
1894,The blood leaves the liver cleaned.,189
1900,Food.,190
1901,Water enter the body.,190
1902,Bloodstream.,190
1903,Food and water enter the pancreas.,190
1904,The pancreas breaks down carbs.,190
1905,Helps digest other foods and liquids.,190
1910,Food enters the body.,191
1911,Food begins to be processed by the digestive system.,191
1912,The pancreas releases enzymes to aid digestion.,191
1913,Digested food affects the amount of sugar in the blood.,191
1914,The pancreas releases one hormone to lower the blood sugar (glucose) level.,191
1915,The pancreas releases another hormone to raisethe blood sugar (glucose) level.,191
1920,Food enters the body.,192
1921,The food is broken down.,192
1922,Sugars from the food enter the bloodstream.,192
1923,Blood sugar must be within a particular range to avoid damaging many organs.,192
1924,Sometimes the brain tells the pancreas the blood sugar (glucose) is too low.,192
1925,The pancreas releases glucagon to change the blood sugar to a better level.,192
1926,Sometimes the brain tells the pancreas the blood sugar (glucose) is too high.,192
1927,The pancreas releases insulin to change the blood sugar to a better level.,192
1930,Sugar enters the body.,193
1931,Bloodstream.,193
1932,The pancreas.,193
1933,Insulin lower sugar levels.,193
1934,Bloo sugar goes back to normal.,193
1940,Grapes are grown.,194
1941,A selection of grapes are gathered.,194
1942,The grapes are washed.,194
1943,The stems are removed from the grapes.,194
1944,The grapes are crushed and added to a fermation container.,194
1945,Yeast is added to the container.,194
1946,"The yeast eats the sugar in the yeast, releasing alcohol.",194
1950,Coal is heated in the boiler.,195
1951,The water tank over the boiler is heated.,195
1952,Creates steam.,195
1953,The steam is funneled to the piston.,195
1954,Piston uses the steam as energy.,195
1955,The piston causes the crankshaft to move.,195
1960,Coal is loaded into the firebox.,196
1961,The boiler produces steam under high pressure.,196
1962,The steam generated in the boiler flows down into a cylinder.,196
1963,"Just ahead of the wheels, pushing a tight-fitting plunger, the piston.",196
1964,The piston is connected to one or more of the locomotive's wheels through a kind of arm-elbow-shoulder joint called a crank and connecting rod.,196
1965,"As the piston pushes, the crank and connecting rod turn the locomotive's wheels and power the train along.",196
1966,An outlet valve opens and the piston pushes the steam back through the cylinder and out up the locomotive's chimney.,196
1970,An airline reservation is made.,197
1971,The passenger arrives early at the airport.,197
1972,The luggage is checked.,197
1973,The passenger waits in line.,197
1974,The passenger shows their identification and gets a boarding pass.,197
1975,The passenger goes to their gate.,197
1976,The passenger gets in line when it's time to board.,197
1977,The person boards the plane.,197
1978,The plane arrives at the destination.,197
1979,The passenger gets off the plane at their destination.,197
1980,"Warm, moist air moves from south to north.",198
1981,"Cool, dry air moves from north to south.",198
1982,The air masses meet.,198
1983,The conditions that form are not stable because the air masses are so different.,198
1984,Winds are directed in a certain way because of how the masses interact.,198
1985,An updraft results.,198
1986,Winds start to form circular patterns in the updraft.,198
1987,A tornado can result.,198
1990,"Warm, humid low-pressure air rises.",199
1991,Creates a strong updraft.,199
1992,"Dry, cold high-pressure air is punched through.",199
1993,The opposing winds create rotation.,199
1994,When the rotation is violent enough a funnel forms.,199
1995,Drops to the ground.,199
2000,Warm weather causes water to evaporate.,200
2001,The water rises up in the air.,200
2002,It starts to cools down.,200
2003,The water starts to condense.,200
2004,It forms into clouds.,200
2005,When there is enough moisture in the clouds it starts to rain.,200
2010,A butterfly starts as an egg.,201
2011,The egg hatches.,201
2012,A larva emerges.,201
2013,The larva eats and grows.,201
2014,The larva sheds its skin.,201
2015,The larva enters a chrysalis.,201
2016,The pupa grows inside the chrysalis.,201
2017,The adult butterfly exits the chrysalis.,201
2018,The adult butterfly is now fully grown.,201
2019,The adult butterfly lays more eggs.,201
2020,A butterfly lays an egg.,202
2021,A larvae matures inside of the egg.,202
2022,The caterpillar hatches from the egg.,202
2023,The caterpillar eats and grows.,202
2024,The caterpillar spins a coccoon around itself and forms into a pupa.,202
2025,The butterfly forms inside of the coccoon.,202
2026,The mature butterfly emerges from the coccoon.,202
2027,The butterfly mates.,202
2028,The female butterfly lays eggs.,202
2030,EGG.,203
2031,ITS LAID ON A LEAF OR PLANT.,203
2032,THE EGG HATCHES.,203
2033,THE LARVA COMES OUT(CATERPILLAR).,203
2034,IT BEGINS TO EAT ON THE LEAF THAT IS WAS BORN ON.,203
2035,CONTINUES TO EAT TO GROW QUICKLY.,203
2036,AFTER ITS GROWN TO FULL LENGHT IT FORMS INTO A PUPA.,203
2037,UNDERGOES METAMORPHOSIS TO BECOME BUTTERFLY.,203
2038,AFTER HE BUTTERFLY IS FOMED IT PUMPS BLOOD INTO ITS WINGS TO GAIN STRENGHT TO BE ABLE TO FLY.,203
2039,TH EBUTTERLFY IS FIANLLY ABLE TO FLY AWAY.,203
2040,Fuel is converted to energy when air and petrol mix.,204
2041,The car engine burns the mix of air and petrol.,204
2042,Hot gas from the burning pushes the pistons.,204
2043,The resulting energy powers the crankshaft.,204
2044,Crankshaft powers the gears.,204
2045,The gears make the wheels roll.,204
2050,Acid rain is produced by chemicals that reach into the atmosphere.,205
2051,Falls onto the ground.,205
2052,The acid rain starts scouring rocks.,205
2053,Destroys vegetation.,205
2054,The lack of vegetation alters the surrounding environment.,205
2060,Acid rain leaches aluminum from clay particles in soil.,206
2061,Aluminum flows into streams and lakes.,206
2062,Acid rain dissolves minerals and nutrients in soil.,206
2063,Washes them away so plants can't benefit from them.,206
2064,PH in soil and water gets affected which can kill plants and animals.,206
2065,Acid rain in fog at higher elevations can strip foliage off trees.,206
2070,Fuel enters the engine through a carburetor or fuel injectors.,207
2071,Air is let into the engine at the same time as the fuel.,207
2072,The piston in the engine moves downwards compressing the air and fuel mixture.,207
2073,A spark plug causes a spark at the bottom stroke of the piston.,207
2074,An explosion occurs in the engine forcing the piston back upwards.,207
2075,As the piston goes up the valves for fuel and air open again.,207
2076,"Fuel and air go in, and the process repeats.",207
2077,The moving pistons are attached via connecting rods to a shaft.,207
2078,The shaft rotates out of the motor to turn the piston energy into rotational energy.,207
2080,"The piston starts at the top, the intake valve opens, and the piston moves down to let the engine take in a cylinder-full of air and gasoline.",208
2081,Then the piston moves back up to compress this fuel/air mixture.,208
2082,Compression makes the explosion more powerful.,208
2083,"When the piston reaches the top of its stroke, the spark plug emits a spark to ignite the gasoline.",208
2084,"The gasoline charge in the cylinder explodes, driving the piston down.",208
2085,"Once the piston hits the bottom of its stroke, the exhaust valve opens and the exhaust leaves the cylinder to go out the tailpipe.",208
2090,Fuels burns in the combustion chamber.,209
2091,The burning fuel creates energy.,209
2092,The upward motion cause air to be released into the cylinder.,209
2093,The piston compresses the air.,209
2094,A spark ignites the fuel and air inside the cylinder.,209
2095,The pressure pushes the piston down.,209
2096,The exhaust valve opens.,209
2097,The piston pushes the air out of the cylinder.,209
2100,Skin is cut or damaged.,210
2101,Bacteria enters through the wound.,210
2102,The bacteria reproduces and spreads.,210
2103,Causes symptoms.,210
2104,The bacteria is either fought off or becomes a disease.,210
