,sentence,sentence ID,paragraphID
1475,the pressure push the piston down.,6,610
1476,the exhaust valve open.,7,610
1477,the piston push the air out of the cylinder.,8,610
1478,skin be cut or damage.,1,611
1479,bacteria enter through the wound.,2,611
1480,the bacteria reproduce and spread.,3,611
1481,cause symptom.,4,611
1482,the bacteria be either fight off or become a disease.,5,611
1483,kidney filter waste out of blood.,1,615
1484,composition of blood be regulate.,2,615
1485,volume of water in blood be keep constant.,3,615
1486,ph be keep at a constant level.,4,615
1487,kidney help regulate blood pressure.,5,615
1488,kidney stimulate the making of red blood cell.,6,615
1489,calcium level be maintain.,7,615
1490,waste product be deposit in the blood.,1,616
1491,Blood be carry to the kidney through the renal artery.,2,616
1492,the kidney contain filter inside.,3,616
1493,the filter capture the waste product.,4,616
1494,the waste be combine with water to make urine.,5,616
1495,the urine leave the kidney and be collect in the bladder.,6,616
1496,the clean blood be return to the body.,7,616
1497,the human body take a breath inward.,1,617
1498,Air be transport to the lung.,2,617
1499,"Air reach the alveolus, the smallest air sac in the lung.",3,617
1500,"in the alveolus, air pas into the blood within small capillary.",4,617
1501,the gaseous oxygen in the air dissolve into the capillary blood.,5,617
1502,the dissolve oxygen be pick - up by red blood cell.,6,617
1503,the red blood cell bind the oxygen via a protein call heme.,7,617
1504,Red blood cell circulate throughout the body and reach the various tissue.,8,617
1505,"within small capillary, the heme release the oxygen.",9,617
1506,the oxygen can then reach the cell within the tissue.,10,617
1507,air go into the lung.,1,618
1508,the lung remove oxygen from the air.,2,618
1509,oxygen diffuse from alveolus in the lung to the bloodstream.,3,618
1510,hemoglobin in red blood cell attach to the oxygen.,4,618
1511,Red blood cell carry oxygen all around the body.,5,618
1512,oxygen diffuse into cell from capillary.,6,618
1513,oxygen enter the body through the mouth or nose.,1,619
1514,the oxygen travel into the lung.,2,619
1515,the oxygen bind to hemoglobin protein within erythrocyte ( red blood cell ).,3,619
1516,the erythrocyte be pump through the body by the heart.,4,619
1517,all cell receive the oxygen.,5,619
1518,the liver take in blood from the rest of the body.,1,624
1519,the liver use enzyme to clean the blood.,2,624
1520,the clean blood be expel.,3,624
1521,the liver create bile from the item filter.,4,624
1522,the liver take energy and store it a glycogen.,5,624
1523,the bile be send to the intestine.,6,624
1524,the pancrea detect chemical change in the stomach.,1,626
1525,the pancrea create juice that help digest food.,2,626
1526,the pancrea release the juice into the stomach.,3,626
1527,trypsin and chymotrypsin digest protein.,4,626
1528,insulin be produce to move glucose from the blood.,5,626
1529,the enzyme begin produce again.,6,626
1530,food enter the small intestine.,1,627
1531,the small intestine produce hormone.,2,627
1532,the hormone cause the pancrea to produce enzyme for digestion.,3,627
1533,the enzyme travel from the pancrea to the small intestine through tube.,4,627
1534,the enzyme help the intestine digest the food.,5,627
1535,the pancrea produce the hormone insuline and glucagon.,6,627
1536,the hormone control the amount of sugar in the blood.,7,627
1537,over 99 % of the exocrine pancrea cell produce digestive juice.,1,628
1538,"they secrete digestive juice "" externally "" into the small intestine.",2,628
1539,"there be enzyme for break down fat, protein, and carbohydrate.",3,628
1540,digestive juice flow from the pancrea through a excretory duct into the small intestine.,4,628
1541,"when the blood sugar level rise, a they might after a meal, insulin be release.",5,628
1542,"when blood sugar level be too low, the pancrea release glucagon into the bloodstream.",6,628
1543,people put trash in a plastic bag.,1,629
1544,the plastic bag be put into a garbage can.,2,629
1545,the garbage can be roll outside.,3,629
1546,the garbage truck come to the house.,4,629
1547,worker take the plastic bag out of the garbage can and place it in the truck.,5,629
1548,the truck drive to the landfill.,6,629
1549,the truck dump the trash into the landfill.,7,629
1550,trash be place into a garbage container in the house.,1,630
1551,the trash be move to a centralize container for the house.,2,630
1552,trash be pick up by a sanitation company.,3,630
1553,the trash be combine in a large truck with trash from all around the city.,4,630
1554,the truck go to the landfill.,5,630
1555,the truck dump the trash into the landfill.,6,630
1556,trash be bag up.,1,631
1557,bag get carry out to the trashcan.,2,631
1558,trashcan be put at the curb once a week.,3,631
1559,can get empty into trash truck.,4,631
1560,a the truck fill it will compact the trash.,5,631
1561,when the truck be full it head to the landfill.,6,631
1562,the truck dump it load into the landfill.,7,631
1563,electricity come into the computer from the plug.,1,632
1564,the electricity run the component in the computer.,2,632
1565,electricity turn the fan to keep the component cool.,3,632
1566,heat be release from the computer.,4,632
1567,electricity run the computer 's display.,5,632
1568,light be form from the electricity.,6,632
1569,electricity enter the power supply unit.,1,634
1570,the power supply give electricity to transistor.,2,634
1571,the power supply give electricity to the cpu.,3,634
1572,the system use electricity to complete task.,4,634
1573,the signal they complete be send out a visual signal.,5,634
1574,the energy be use to complete computation.,6,634
1575,a egg be lay by a mother bird.,1,635
1576,a baby bird form within the egg if it be fertilize.,2,635
1577,the baby bird begin peck out of the egg.,3,635
1578,the baby bird be unable to fly to get food.,4,635
1579,the mother bird must feed the baby bird food.,5,635
1580,the bird grow stronger and grow wing.,6,635
1581,the bird be able to fly.,7,635
1582,the bird be able to leave the nest and find food.,8,635
1583,the bird be able to reproduce.,9,635
1584,a bird lay a egg.,1,636
1585,the egg hatch into a baby bird.,2,636
1586,baby bird eat.,3,636
1587,grow into a adult bird.,4,636
1588,the bird find a mate.,5,636
1589,the pair build a nest.,6,636
1590,the bird lay egg.,7,636
1591,a bird hatch from a egg.,1,637
1592,the bird be nurture by it parent.,2,637
1593,and be feed food for growth.,3,637
1594,the bird grow.,4,637
1595,begin to learn how to fly.,5,637
1596,the bird mature.,6,637
1597,the bird leave it nest.,7,637
1598,the bird make it own nest.,8,637
1599,Fish lay egg.,1,640
1600,egg hatch.,2,640
1601,tiny fish call fry emerge.,3,640
1602,fry eat and grow.,4,640
1603,fry become adult fish.,5,640
1604,Fish mate and more egg be produce.,6,640
1605,a tadpole be hatch.,1,641
1606,the tadpole eventually grow hind leg.,2,641
1607,the tadpole lose it tail.,3,641
1608,the tadpole become a frog.,4,641
1609,the frog mate with another frog to produce more offspring.,5,641
1610,a tadpole be hatch.,6,641
1611,the cycle begin again.,7,641
1612,frog lay thousand of egg.,1,642
1613,egg cluster float around in water.,2,642
1614,tadpole with gill hatch from the egg.,3,642
1615,tadpole swim in water until they grow leg.,4,642
1616,absorb they tail.,5,642
1617,then the tadpole become a froglet.,6,642
1618,then the froglet become a frog.,7,642
1619,the frog 's egg hatch and a tadpole be bear.,1,643
1620,the tadpole swim with it sibling and try to survive.,2,643
1621,the tadpole grow larger.,3,643
1622,the tadpole lose it tail.,4,643
1623,the tadpole develop limb.,5,643
1624,and the tadpole now become a frog.,6,643
1625,a sperm meet a egg in the uterus of a woman.,1,644
1626,the sperm implant itself into the egg.,2,644
1627,the sperm and egg form a zygote on the wall of the uterus.,3,644
1628,the fetus grow and develop.,4,644
1629,the woman give birth to a baby.,5,644
1630,the baby be raise by parent until it be able to take care of itself.,6,644
1631,the person go out into the world and find a job.,7,644
1632,the person meet other people and have a life.,8,644
1633,"the person get a career, and get marry.",9,644
1634,the person retire and eventually pas away.,10,644
1635,a sperm and egg meet inside a woman 's fallopian tube.,1,645
1636,"the fertilize egg, now a zygote, travel to the uterus.",2,645
1637,the zygote implant in the uterus.,3,645
1638,the zygote become a embryo.,4,645
1639,the embryo become a fetus.,5,645
1640,the fetus grow for approximately 9 month.,6,645
1641,the woman give birth to a baby.,7,645
1642,the baby grow into a child.,8,645
1643,the child become a adult.,9,645
1644,the adult mate with another adult.,10,645
1645,a seed germinate.,1,647
1646,it grow into a plant.,2,647
1647,the mature plant produce flower.,3,647
1648,the flower become fertilize.,4,647
1649,produce seed in a fruit or seedpod.,5,647
1650,the plant die.,6,647
1651,the new seed germinate to form a new plant.,7,647
1652,a seed be plant.,1,648
1653,it become a seedling.,2,648
1654,the seedling grow into a full - grow plant.,3,648
1655,the plant release some kind of pollenating product.,4,648
1656,the plant either self - pollinate or be spread by insect or bird.,5,648
1657,seed be plant.,6,648
1658,the cycle begin again.,7,648
1659,a seed must find it be way to the earth.,1,649
1660,the seed when give nutrient will sprout.,2,649
1661,the sprouting will develop a root system.,3,649
1662,the plant will grow larger until it mature.,4,649
1663,the plant will thrive.,5,649
1664,the plant will die.,6,649
1665,become nourishment for other plant.,7,649
1666,adult rabbit mate.,1,652
1667,the female become pregnant.,2,652
1668,the female give birth to rabbit baby.,3,652
1669,the rabbit baby grow into adult rabbit.,4,652
1670,the new adult mate with other rabbit.,5,652
1671,produce more rabbit.,6,652
1672,a seed be plant.,1,653
1673,it become a seedling.,2,653
1674,it grow into a tree.,3,653
1675,the tree grow flower.,4,653
1676,the flower become fruit.,5,653
1677,the fruit contain seed for new tree.,6,653
1678,a seedling be grow in the ground.,1,654
1679,"the seedling grow bigger, and form it root system.",2,654
1680,the root start to gain more nourishment a the tree grow.,3,654
1681,the tree start to attract animal and plant that will grant it more nourishment.,4,654
1682,the tree mature.,5,654
1683,"after a number of year the tree will grow old and die, become material for new growth.",6,654
1684,a larva be bear.,1,656
1685,the caterpillar eat constantly until it grow bigger.,2,656
1686,the caterpillar start to form a cocoon around itself.,3,656
1687,the caterpillar become a pupa.,4,656
1688,after some time the cocoon hatch.,5,656
1689,and a butterfly be bear.,6,656
1690,the butterfly start a a egg.,1,658
1691,"the egg hatch to form a larva, also call a caterpillar.",2,658
1692,the carterpillar molt ( lose it be skin ) many time a it grow.,3,658
1693,"the caterpillar then form itself into a pupa, or chrysalis.",4,658
1694,"the caterpillar in the chrysalis begin change, a process call mmetaphorphosis.",5,658
1695,the caterpillar complete it metamorphosis and have turn into a butterfly.,6,658
1696,the adult butterfly emerge out of the chrysalis and fly away !.,7,658
1697,bacteria change nitrogen into ammonium through fixation.,1,659
1698,the nitrification process be where ammonium get change into nitrate by bacteria.,2,659
1699,plant absorb the nitrate from soil into they root through assimilation.,3,659
1700,"when plant die, fungi and bacteria turn nitrogen back into ammonium through ammonification.",4,659
1701,the denitrification process push extra nitrogen from soil into the air.,5,659
1702,the cycle repeat from step 1.,6,659
1703,Nitrogen - fix bacteria convert atmospheric nitrogen to organic nitrogen.,1,660
1704,plant absorb organic nitrogen from the soil through they root.,2,660
1705,animal eat the plant.,3,660
1706,plant and animal die.,4,660
1707,animal expel waste.,5,660
1708,fungi convert organic nitrogen to ammonium.,6,660
1709,nitrify bacteria convert ammonium to nitrate.,7,660
1710,bacteria convert nitrate to nitrogen gas.,8,660
1711,Nitrogen gas escape from soil into the atmosphere.,9,660
1712,fixation be the first step in the process of make nitrogen usable by plant. here bacteria change nitrogen into ammonium.,1,661
1713,nitrification be the process by which ammonium get change into nitrate by bacteria.,2,661
1714,nitrate be what the plant can then absorb.,3,661
1715,assimilation be how plant get nitrogen.,4,661
1716,"they absorb nitrate from the soil into they root. then the nitrogen get use in amino acid, nucleic acid, and chlorophyll.",5,661
1717,Ammonification be part of the decaying process.,6,661
1718,"when a plant or animal die, decomposer like fungi and bacteria turn the nitrogen back into ammonium so it can reenter the nitrogen cycle.",7,661
1719,denitrification be when extra nitrogen in the soil get put back out into the air.,8,661
1720,there be special bacteria that perform this task a well.,9,661
1721,boil salt water.,1,665
1722,the water will turn into water vapor.,2,665
1723,collect the water vapor.,3,665
1724,allow the water vapor to cool.,4,665
1725,the water vapor will turn into liquid water.,5,665
1726,the salt will be separate from the water.,6,665
1727,Water be heat.,1,666
1728,the heat water evaporate.,2,666
1729,the salt be leave behind.,3,666
1730,the evaporate water condense on a cold surface.,4,666
1731,the evaporate water be collect.,5,666
1732,the process be repeat.,6,666
1733,more salt be remove from the water.,7,666
1734,solution cave be form in limestone and similar rock by the action of water.,1,667
1735,"after a rain, water seep into crack and pore of soil and rock.",2,667
1736,the water percolate beneath the land surface.,3,667
1737,some of the water reach a zone where all the crack and pore in the rock be already fill with water.,4,667
1738,rainwater absorb some carbon dioxide a it pas through the atmosphere and even more a it drain through soil and decay vegetation.,5,667
1739,the water combine chemically with the carbon dioxide.,6,667
1740,a weak carbonic acid solution be form.,7,667
1741,"this acid slowly dissolve calcite, form solution cavity, and excavate passageway.",8,667
1742,a liquid be heat from a external source.,1,671
1743,the heat cause the molecule in the liquid to increase in energy.,2,671
1744,"a the molecule absorb more energy, they start to move faster.",3,671
1745,a the molecule be move faster they be increase in temperature.,4,671
1746,"when the molecule reach a certain temperature, the boiling point, they change from liquid to gas state.",5,671
1747,"a the liquid molecule go into a gaseous state, they float out into the atmosphere.",6,671
1748,"when all the liquid have turn to gas, it have evaporate completely, leave no liquid behind.",7,671
1749,a organism die.,1,674
1750,Water seep into the remains.,2,674
1751,mineral dissolve in the water form crystal.,3,674
1752,crystalize mineral cause the remains to hard.,4,674
1753,the mineral form a fossil.,5,674
1754,animal and plant die in soft soil or mud.,1,675
1755,sediment build up over the remains.,2,675
1756,"the remains decompose, leave only trace amount.",3,675
1757,the remain part over the year be replace with mineral.,4,675
1758,a fossil be form.,5,675
1759,a plant die.,1,676
1760,the remains of the plant be bury very fast in sediment.,2,676
1761,the soft part of the plant decay.,3,676
1762,the hard part of the plant be replace with mineral.,4,676
1763,the sediment turn into rock.,5,676
1764,the rock erode.,6,676
1765,the fossil appear on the surface of the ground.,7,676
1766,the animal eat large quantity of food that will be store a fat.,1,681
1767,Winter come and the animal find a place to hibernate.,2,681
1768,"over a period of day, the animal 's heart rate and breathing rate drop slowly.",3,681
1769,"electrical activity in the brain almost cease completely, though some area remain active.",4,681
1770,the animal have enter hibernation mode.,5,681
1771,the body 's temperature increase over 98.6 degree F.,1,683
1772,the hypothalamus in the brain send a message to the body.,2,683
1773,sweat gland in the skin receive the message.,3,683
1774,the sweat gland start combine water and chemical to make sweat.,4,683
1775,the sweat leave the skin through pore.,5,683
1776,carbon dioxide pas through stoma in the leave.,1,686
1777,Water be absorb through root.,2,686
1778,chloroplast cell in leave contain chlorophyll.,3,686
1779,chlorophyll absorb energy from sunlight.,4,686
1780,energy split water molecule into hydrogen and oxygen.,5,686
1781,oxygen get release into atmosphere.,6,686
1782,hydrogen and carbon dioxide use to create glucose.,7,686
1783,glucose be food for plant.,8,686
1784,carbon dioxide from the air pas through small pore ( hole ) in the leave. these pore be call stoma.,1,687
1785,Water be absorb by the root and pas through vessel in the stem on it way to the leave.,2,687
1786,chlorophyll absorb the sun 's energy.,3,687
1787,it be this energy that be use to split water molecule into hydrogen and oxygen.,4,687
1788,oxygen be release from the leave into the atmosphere.,5,687
1789,hydrogen and carbon dioxide be use to form glucose or food for plant.,6,687
1790,seed be sow into the ground.,1,689
1791,the earth where the seed be plant be give water and fertilizer.,2,689
1792,the seed start to grow and become seedling.,3,689
1793,the plant be give water.,4,689
1794,the seedling grow into plant.,5,689
1795,weed grow near the plant be remove.,6,689
1796,the plant grow to maturity.,7,689
1797,the farmer choose a crop that will grow well in he region.,1,690
1798,the farmer till the soil to loose it.,2,690
1799,the farmer spread seed.,3,690
1800,the farmer till again to plant the seed.,4,690
1801,crop grow.,5,690
1802,one type of air pollution be the addition of carbon dioxide gas into the air.,1,693
1803,some scientist believe that release too much carbon dioxide into the atmosphere be one of the cause of global warming.,2,693
1804,this upset the balance of the carbon cycle.,3,693
1805,the ozone layer help protect we from harmful ray from the sun.,4,693
1806,it be get damage from air pollution such a methane gas from livestock and cfc from spray can.,5,693
1807,Acid rain be create when gas such a sulfur dioxide get high into the atmosphere.,6,693
1808,the wind can blow these gas for mile and then they get wash out of the air when it rain.,7,693
1809,this rain be call acid rain and can damage forest and kill fish.,8,693
1810,during evaporation the sun heat up water in river or lake or the ocean and turn it into vapor or steam.,1,695
1811,"the water vapor or steam leave the river, lake or ocean and go into the air.",2,695
1812,"Water vapor in the air get cold and change back into liquid, form cloud, which be call condensation.",3,695
1813,precipitation occur when so much water have condense that the air can not hold it anymore.,4,695
1814,"Water fall back to the earth in the form of rain, hail, sleet or snow.",5,695
1815,"when water end up on land, it will either soak into the earth and become part of the "" ground water "" for animal or plant to drink.",6,695
1816,"it may also run into the ocean, lake, or river where the cycle start again.",7,695
1817,air contain invisible moisture call water vapor.,1,696
1818,excess water vapor be condense out a water in the form of water droplet.,2,696
1819,Water droplet be carry up into the cloud.,3,696
1820,the cloud become heavy with water droplet.,4,696
1821,when the cloud be saturate.,5,696
1822,rain will fall.,6,696
1823,Water being to evaporate from body of water.,1,697
1824,the water condense into cloud.,2,697
1825,the cloud travel and accumulate more water.,3,697
1826,the cloud reach a point where they can not hold any more water.,4,697
1827,it begin to rain on area below the cloud.,5,697
1828,a can be throw away into a recycling bin.,1,698
1829,the can be take to a recycling center.,2,698
1830,melt down along with other can.,3,698
1831,the melt metal be turn into bar.,4,698
1832,become material for other product.,5,698
1833,the consumer throw aluminum can and foil into a recycle bin.,1,699
1834,the aluminum be collect.,2,699
1835,take to a treatment plant.,3,699
1836,the aluminum be sort and clean ready for reprocessing.,4,699
1837,the aluminum be re-melt.,5,699
1838,turn into molten aluminum.,6,699
1839,the aluminum be make into large block call ingot.,7,699
1840,the ingot be send to mill to be roll out.,8,699
1841,the roll out product be make into new aluminum product.,9,699
1842,the sun give off radiation.,1,701
1843,the radiation be aborb by the Earth.,2,701
1844,some of the radiation go back into space.,3,701
1845,some be trap by the atmosphere.,4,701
1846,if too much heat be trap.,5,701
1847,global warming occur.,6,701
1848,several type of gas form in the atmosphere.,1,702
1849,may come from different source.,2,702
1850,the gas remain trap in the atmosphere.,3,702
1851,through the sun light the gas hold in heat and energy.,4,702
1852,trap they in we atmosphere.,5,702
1853,the earth may become warmer this way.,6,702
1854,greenhouse gas be release into the air by human activity.,1,703
1855,the earth change energy from the sun into heat.,2,703
1856,heat rise from the ground.,3,703
1857,greenhouse gas molecule in the atmosphere prevent the heat from go into space.,4,703
1858,the temperature of the earth increase.,5,703
1859,the temperature continue to rise and melt the polar ice cap.,6,703
1860,the temperature rise even faster.,7,703
1861,you take some paper.,1,704
1862,the writing tool.,2,704
1863,you write a message describe what be on you mind.,3,704
1864,you put the letter into a envelope.,4,704
1865,you take the letter to the post office.,5,704
1866,send it to it recipient.,6,704
1867,you find a pen.,1,705
1868,you get a piece of paper.,2,705
1869,you write you letter.,3,705
1870,you put it in a envelope.,4,705
1871,you put the address on the front.,5,705
1872,you put a stamp on the front.,6,705
1873,you take it to the post office.,7,705
1874,you gather a writing utensil and a piece of paper.,1,706
1875,you use the writing utensil to compose you letter on the paper.,2,706
1876,you fold the paper.,3,706
1877,place it into a envelope.,4,706
1878,you write the address of the recipient on the outside of the envelope.,5,706
1879,you seal the envelope with moisture or tape.,6,706
1880,you apply a stamp to the outside of the envelope.,7,706
1881,you put the envelope in a mailbox for a letter carrier to collect.,8,706
1882,the letter carrier take the envelope to the correct address.,9,706
1883,rock be constantly wear down and break by erosion.,1,708
1884,erosion can be wind or water.,2,708
1885,erosion break they down to sediment.,3,708
1886,sediment get compress and heat or get bury.,4,708
1887,when sediment be bury it then get melt.,5,708
1888,when sediment be compress it become metamorphic rock.,6,708
1889,metamorphic rock get bury.,7,708
1890,bury metamorphic rock get melt.,8,708
1891,melt rock eventually cool.,9,708
1892,rock push back to the surface.,10,708
1893,Blood fill with waste flow into the kidney.,1,716
1894,the kidney be make up of filtering unit call nephron.,2,716
1895,the nephron in the kidney filter the blood.,3,716
1896,produce urine.,4,716
1897,the urine leave the kidney.,5,716
1898,the clean blood go back into the body.,6,716
1899,Sunlight enter the atmosphere.,1,720
1900,the light reach the ocean.,2,720
1901,the ocean be warm.,3,720
1902,Water evaporate.,4,720
1903,Water vapor accumulate in the air.,5,720
1904,"a it cool, water condense onto particle of dust in the air.",6,720
1905,"a enough water condense, cloud be form.",7,720
1906,Water vapor be in warm air.,1,721
1907,the warm air cool.,2,721
1908,the warm air expand.,3,721
1909,the water vapor in the air condense.,4,721
1910,the water vapor form water droplet or ice crystal.,5,721
1911,most fossil be form when a plant or animal die in a watery environment and be bury in mud and silt.,1,725
1912,Soft tissue quickly decompose leave the hard bone or shell behind.,2,725
1913,over time sediment build over the top and harden into rock.,3,725
1914,"a the encase bone decay, mineral seep in replace the organic material cell by cell in a process call "" petrification. "".",4,725
1915,alternatively the bone may completely decay leave a cast of the organism.,5,725
1916,he void leave behind may then fill with mineral make a stone replica of the organism.,6,725
1917,a animal live a happy life.,1,726
1918,the animal get very old.,2,726
1919,the animal die.,3,726
1920,the animal 's skeleton sink to the bottom of a ocean.,4,726
1921,the skeleton be bury by mud.,5,726
1922,more sand and mud fall on the skeleton.,6,726
1923,pressure increase on the skeleton from the weight of more mud.,7,726
1924,the sand and mud turn into rock.,8,726
1925,the skeleton dissolve in the water.,9,726
1926,a hole be preserve in rock that be the shape of the skeleton.,10,726
1927,a animal die.,1,727
1928,be be bury in a watery environment.,2,727
1929,the soft tissue quickly decompose.,3,727
1930,the bone be leave behind.,4,727
1931,"over time, mud and silt accumulate over the bone.",5,727
1932,mud and silt hard into rock.,6,727
1933,the bone slowly decay.,7,727
1934,mineral seep in.,8,727
1935,replace the organic material.,9,727
1936,you have a fossil.,10,727
1937,a stream or river must occur.,1,731
1938,"through erosion, the stream cut into the soil and bedrock.",2,731
1939,"through continuous erosion, a deep gash be cut through.",3,731
1940,after many year the river may dry up.,4,731
1941,a dry ravine be leave.,5,731
1942,animal may come across vegetation.,1,737
1943,the animal may consume or get seed stick in they fur.,2,737
