,sentence,sentence ID,paragraphID
1944,the animal travel some distance someplace else.,3,737
1945,the seed be drop or deposit off.,4,737
1946,the seed have a new place to proliferate and grow.,5,737
1947,a animal walk be by a plant.,1,739
1948,the animal get seed stick in they fur.,2,739
1949,the animal eat some fruit of the tree contain seed.,3,739
1950,the animal lose seed from the fur in other location.,4,739
1951,then eat seed be defecate out in other location.,5,739
1952,the bat send out sound wafe from they mouth or nose.,1,742
1953,the sound wafe hit a object.,2,742
1954,echo be produce.,3,742
1955,the echo return to the bat 's ear.,4,742
1956,the bat hear the echo.,5,742
1957,the bat can figure out where the object be locate.,6,742
1958,a bee land on the flower.,1,743
1959,they foot slip into little groove that hold pollen sac.,2,743
1960,"when the bee fly off, it carry off the pollen sac.",3,743
1961,the bee land on another plant.,4,743
1962,the pollen sac fall off and pollinate the plant.,5,743
1963,bee land on flower and eat the nectar of the plant.,1,744
1964,while on the flower pollen get on the bee 's fur.,2,744
1965,the bee fly to another area with other flower.,3,744
1966,the pollen be deposit in that area.,4,744
1967,a plant be able to reproduce.,5,744
1968,a bee visit a flower.,1,745
1969,the hair on the bee leg collect pollen.,2,745
1970,the bee move on to a different flower.,3,745
1971,some pollen fall off the bee.,4,745
1972,the flower be pollinate.,5,745
1973,some of the rock in the ground be make of limestone.,1,746
1974,over long period of time rain can hit the limestone.,2,746
1975,and cause a acidic reaction.,3,746
1976,the limestone will slowly disintegrate.,4,746
1977,a large gap with be where the limestone be.,5,746
1978,result in the cave.,6,746
1979,Water from the surface seep below the soil.,1,747
1980,the water come into contact with the rock below.,2,747
1981,the rock over the year carve through the rock.,3,747
1982,the space in the rock become larger and form into a cave.,4,747
1983,a more rather rush through the cave become a cavern.,5,747
1984,a engine must be power by gas or some fuel source.,1,758
1985,the fuel source will power a alternator.,2,758
1986,a alternator will convert mechanical energy in to measurable electrical energy.,3,758
1987,electrical energy will be channel and move.,4,758
1988,the electron will run through to the outlet of the generator.,5,758
1989,"when you plug something in to the outlet of the generator, a flow of current will conduct electron.",6,758
1990,green be a color that gather sunlight easily.,1,769
1991,Sunlight be gather by the leave of the plant.,2,769
1992,the sunlight be break down into glucose through photosynthesis.,3,769
1993,the glucose travel the plant.,4,769
1994,the plant use that glucose a energy to grow.,5,769
1995,you breathe air in.,1,770
1996,Air enter bronchial tube.,2,770
1997,Air be then split into the bronchiole of each lung.,3,770
1998,bronchiole have alveolus which be tiny air sac.,4,770
1999,alveolus be surround by many small blood vessel.,5,770
2000,oxygen pas through alveolus into blood vessel.,6,770
2001,Blood leave the lung a it travel through the body.,7,770
2002,Blood carry carbon dioxide back to the lung.,8,770
2003,carbon dioxide release when you exhale.,9,770
2004,Air be take into the body via the nose or mouth.,1,771
2005,the air travel into the windpipe.,2,771
2006,the windpipe divide the air to the two lung via the bronchial tube.,3,771
2007,the lung oxygenate the blood in the body.,4,771
2008,carbon dioxide be filter out by every cell in the body.,5,771
2009,the carbon dioxide be carry back to the lung via the bloodstream.,6,771
2010,the carbon dioxide be exhale.,7,771
2011,Air be draw in through the mouth.,1,772
2012,the air go down the esophagus.,2,772
2013,the air move into the lung.,3,772
2014,the carbon dioxide be remove.,4,772
2015,the remain oxygen enter the body.,5,772
2016,the remain carbon dioxide be expel through the mouth.,6,772
2017,Magma cool inside the crust.,1,773
2018,Magma crystalize.,2,773
2019,lava cool on the surface.,3,773
2020,lava crystalize.,4,773
2021,mineral dissolve in water crystlize.,5,773
2022,there be place inside Earth where rock will melt.,1,775
2023,"melt rock inside the Earth be also call molten rock, or magma.",2,775
2024,"Magma move up through Earth 's crust, but it do not always reach the surface.",3,775
2025,"when magma erupt onto Earth 's surface, it be know a lava.",4,775
2026,a lava flow from volcanoe it start to cool.,5,775
2027,mineral form when magma and lava cool.,6,775
2028,plant absorb water from the ground through they root system.,1,779
2029,"use sunlight, the plant separate the hydrogen and oxygen molecule through the process of photosynthesis.",2,779
2030,the plant release the oxygen into the atmosphere.,3,779
2031,combine the hydrogen with carbon dioxide to create a intermediate.,4,779
2032,the intermediate be use to produce glucose which be the plant 's food.,5,779
2033,plant create light weight seed.,1,782
2034,the wind be able to blow the seed off of the plant.,2,782
2035,the wind carry the seed through the air to other area.,3,782
2036,the seed get catch in the fur of animal.,4,782
2037,the animal move and lay down on the ground.,5,782
2038,the seed get deposit on the ground.,6,782
2039,the seed become plant.,7,782
2040,plant produce fruit which contain seed of the plant.,1,783
2041,a animal eat the fruit from a plant.,2,783
2042,the animal digest the fruit.,3,783
2043,the seed be not digest.,4,783
2044,the seed pas through the animal 's digestive system.,5,783
2045,the seed be in the animal 's dropping.,6,783
2046,the seed be now in another location and can grow.,7,783
2047,a plant produce a fruit with seed in it.,1,784
2048,a animal eat the fruit.,2,784
2049,the animal wander to another area.,3,784
2050,the animal defecate.,4,784
2051,the seed be include in the waste.,5,784
2052,the seed produce a new plant.,6,784
2053,photovoltaic cell be solar cell.,1,791
2054,photovoltaic cell be make from silicon.,2,791
2055,Sun shine on the solar cell which generate DC electricity.,3,791
2056,electricity be feed into a inverter to change it to AC electricity.,4,791
2057,electricity be then send into the home to be use.,5,791
2058,extra electricity can be send to the main power grid for other.,6,791
2059,Air enter the lung through bronchial tube.,1,794
2060,air enter bronchiole.,2,794
2061,bronchiole have tiny air sac call alveolus.,3,794
2062,alveolus surround by small blood vessel.,4,794
2063,oxygen absorb by small blood vessel.,5,794
2064,vessel deliver oxygen to every cell in the body.,6,794
2065,Blood bring carbon dioxide back to lung.,7,794
2066,carbon dioxide release when you exhale.,8,794
2067,you breathe in.,1,795
2068,"air go through all the little branch in you lung to fill up the air sac, or alveolus.",2,795
2069,oxygen go through the wall of the alveolus and into the capillary.,3,795
2070,the oxygen go into the bloodstream.,4,795
2071,oxygen be leave and carbon dioxide be pick up.,5,795
2072,you breathe it out through you lung.,6,795
2073,Air be bring in through the mouth.,1,796
2074,pas through the lung.,2,796
2075,and into the bronchial tissue.,3,796
2076,the carbon dioxide be remove.,4,796
2077,the lung bring the oxygen to the rest of the body.,5,796
2078,get a ice cube tray.,1,807
2079,fill the tray with cool water.,2,807
2080,place the tray in the freezer.,3,807
2081,leave the tray in the freezer for a few hour.,4,807
2082,take they tray out of the freezer.,5,807
2083,pop the ice cube out of tray.,6,807
2084,you find a empty ice cube tray.,1,808
2085,you fill the tray with warm water.,2,808
2086,"you carefully place the tray on a even surface in a freezer that be at least 32 degree Farhenheit, the freezing point of water.",3,808
2087,the water begin to get colder until it start to freeze solid.,4,808
2088,"the water expand a it freeze, one of the few liquid that have greater volume a a solid.",5,808
2089,"because you use warm water, the gas in the water have evaporate out, so you will have nice clear ice cube without crack from the trap gas.",6,808
2090,energy be store in a battery.,1,817
2091,the energy be release from the battery a electrical current.,2,817
2092,the electrical current go to a motor.,3,817
2093,the motor make the needle of the sewing machine go up and down.,4,817
2094,the needle be press through the piece of clothing at a constant rate.,5,817
2095,thread be attach and use to stitch the clothing.,6,817
2096,Coal be burn at a furnace.,1,821
2097,the result heat energy be use to heat water.,2,821
2098,the heat water be turn into steam.,3,821
2099,the steam drive a generator.,4,821
2100,electricity be produce.,5,821
2101,Coal be mix with hot air in a power station.,1,823
2102,Water be send through pipe in the power station.,2,823
2103,the water pipe go through a firebox in the power station.,3,823
2104,the coal be put in the air in the firebox.,4,823
2105,the water heat up so it be very hot.,5,823
2106,the water turn into steam.,6,823
2107,the steam be push out of the pipe into a separate area.,7,823
2108,the steam power turbine.,8,823
2109,magnet in the turbine spin in wire coil.,9,823
2110,electricity be produce.,10,823
2111,Uranium be underground.,1,825
2112,Uranium be dug up.,2,825
2113,Uranium be bring to nuclear power plant.,3,825
2114,uranium atom be split into two smaller atom.,4,825
2115,heat energy be release from the uranium.,5,825
2116,the heat energy turn water into steam in a nuclear reactor.,6,825
2117,the steam turn big turbine.,7,825
2118,the turbine drive generator.,8,825
2119,the generator make electricity.,9,825
2120,the steam turn back into water.,10,825
2121,a nuclear reactor generate heat by nuclear fission.,1,826
2122,the heat create raise steam.,2,826
2123,the steam run through turbine.,3,826
2124,the turbine generate electricity.,4,826
2125,the electricity leave the station.,5,826
2126,a fuel be heat in a oven.,1,828
2127,above the oven be a tank of water that be seal.,2,828
2128,the tank of water begin to boil above the oven.,3,828
2129,a the water boil steam be create.,4,828
2130,the steam be denser than air so it need a place to go.,5,828
2131,the steam be force out of the tank and into a piston.,6,828
2132,the piston move up.,7,828
2133,the valve of the piston close.,8,828
2134,the valve on the next piston open.,9,828
2135,"the steam fill the next piston, drive it up, and the other one down.",10,828
2136,"the flu virus have receptor, which be like viral velcro, on the surface of the virus particle.",1,830
2137,"the receptor will lock onto a target cell use these chemical receptor on the surface, which dock onto the cell surface.",2,830
2138,the receptor then go into the cell.,3,830
2139,the receptor use it like a factory.,4,830
2140,the receptor take it over and make it produce thousand or in some case million of copy of new virus.,5,830
2141,the copy come stream out of the cell.,6,830
2142,"the copy infect other cell to make more virus, or they escape from the body and infect a new victim.",7,830
2143,a virus enter a host body.,1,834
2144,the virus have receptor that lock onto a target cell.,2,834
2145,the virus enter the cell.,3,834
2146,the virus use the cell like a factory to make new copy of the virus.,4,834
2147,the new copy of the virus leave the cell.,5,834
2148,infect other cell.,6,834
2149,the host get sick a it cell be damage.,7,834
2150,electromagnet create magnetic field with electricity.,1,842
2151,conductive copper wire be wrap around a piece of metal.,2,842
2152,a electric current get introduce from power source.,3,842
2153,flow through the wire.,4,842
2154,magnetic field get create in the wire.,5,842
2155,and the metal get magnetize.,6,842
2156,when turn off it be no longer magnetic.,7,842
2157,"a conduct metal, like copper, be wrap around a piece of metal.",1,844
2158,"a electrical source, like a battery, produce a electrical current.",2,844
2159,the electrical current flow through the wire.,3,844
2160,"the electrical current create a magnetic field around the wire, magnetize the metal.",4,844
2161,the magnetic field can be turn on and off by start or stop the electricity source.,5,844
2162,Blood deliver oxygen in the body.,1,846
2163,protein and acid be break down in the liver.,2,846
2164,the liver release waste in the form of urea.,3,846
2165,the blood carry the urea and carbon dioxide to the kidney.,4,846
2166,the kidney strain the urea and salt need from the blood.,5,846
2167,the carbon dioxide by product be transport back to the lung.,6,846
2168,carbon dioxide be exhale by the lung.,7,846
2169,a machine call a pulverizer grind the coal into a fine powder.,1,852
2170,"the coal powder mix with hot air, which help the coal burn more efficiently, and the mixture move to the furnace.",2,852
2171,"the burn coal heat water in a boiler, create steam.",3,852
2172,"steam release from the boiler power a engine call a turbine, transform heat energy from burn coal into mechanical energy that spin the turbine engine.",4,852
2173,"the spinning turbine be use to power a generator, a machine that turn mechanical energy into electric energy.",5,852
2174,this happen when magnet inside a copper coil in the generator spin.,6,852
2175,"a condenser cool the steam move through the turbine. a the steam be condense, it turn back into water.",7,852
2176,"the water return to the boiler, and the cycle begin again.",8,852
2177,a mold spore float through the air.,1,867
2178,the spore land on a piece of bread.,2,867
2179,the spore grow hypha into the bread.,3,867
2180,the mold form a colony.,4,867
2181,sporangiophore grow upward.,5,867
2182,the mold send out spore.,6,867
2183,a rig drill into the earth where oil be present.,1,872
2184,a pipe be place in the hole.,2,872
2185,a pump be add to the pipe.,3,872
2186,oil be pump out.,4,872
2187,oil be place in barrel.,5,872
2188,barrel be load on truck.,6,872
2189,truck go to a refinery.,7,872
2190,crude oil be refine to motor oil.,8,872
2191,motor oil be bottle.,9,872
2192,ship to gas station.,10,872
2193,the oil be extract either onshore or offshore by large oil rig.,1,873
2194,crude oil be transport to a refinery.,2,873
2195,the refinery turn the crude oil into gasoline.,3,873
2196,the gasoline be load onto tank truck.,4,873
2197,the tank truck go to gas station all over the place.,5,873
2198,the gasoline be deliver to the gas station.,6,873
2199,the oil need to be pump from the ground.,1,874
2200,after it be pump it then be transport to a factory.,2,874
2201,in the factory the oil be process and turn into fuel.,3,874
2202,once the fuel be refine it be then send to a truck.,4,874
2203,by truck the fuel be send to the gas station.,5,874
2204,Water vapor get into the atmosphere through a process call evaporation.,1,876
2205,"this then turn the water that be at the top of ocean, river and lake into water vapor in the atmosphere use energy from the sun.",2,876
2206,the water vapor rise in the atmosphere and there it cool down.,3,876
2207,Water vapor rise in the atmosphere and there it cool down and form tiny water droplet through something call condensation.,4,876
2208,these then turn into cloud.,5,876
2209,"when they all combine together, they grow bigger and be too heavy to stay up there in the air.",6,876
2210,"this be when they will fall to the ground a rain, or maybe snow or hail by gravity.",7,876
2211,warm air from the surface rise into the higher cold air.,1,877
2212,the water vapor in the air be condense.,2,877
2213,the condense water and dust form a cloud.,3,877
2214,wind in the cloud bounce the water droplet around.,4,877
2215,the bouncing droplet join together.,5,877
2216,the bigger droplet get heavy.,6,877
2217,the heavy droplet fall.,7,877
2218,"a they fall, they join with more moisture in the air.",8,877
2219,the droplet get larger.,9,877
2220,Rain fall.,10,877
2221,warm water rise off the sea.,1,879
2222,the water condense a it cool and get higher in the air.,2,879
2223,then the condensation form into cloud.,3,879
2224,the cloud travel over area on land.,4,879
2225,the cloud reach a saturation point.,5,879
2226,the water fall from the cloud.,6,879
2227,Water evaporate and become gaseous.,1,880
2228,the vapor go into the air.,2,880
2229,and the rain become cloud in the atmosphere.,3,880
2230,the cloud become too heavy and it start to fall.,4,880
2231,it become rain.,5,880
2232,item that can be reuse be place into recycling container.,1,882
2233,recycling truck pick up the item that be able to be reuse.,2,882
2234,the recyclable item travel to a recycling plant.,3,882
2235,the item be sort by what they be make of.,4,882
2236,the item be break down into small part.,5,882
2237,the small part be melt to make new raw part.,6,882
2238,the raw part be sell to manufacture to make new item.,7,882
2239,Water in the cloud become very cold.,1,892
2240,the cold water form ice crystal.,2,892
2241,the ice crystal grow by absorb surround water droplet.,3,892
2242,form snowflake.,4,892
2243,the snowflake fall to the ground.,5,892
2244,Blood sugar level increase after a meal.,1,893
2245,cell in the pancrea release insulin.,2,893
2246,insulin cause the body to absorb glucose from the blood.,3,893
2247,Blood sugar go back to normal.,4,893
2248,Blood sugar be too low.,5,893
2249,the amount of insulin go down.,6,893
2250,cell in the pancrea release glucagon.,7,893
2251,the liver turn store glycogen into glucose.,8,893
2252,the liver release the glucose into the blood.,9,893
2253,Blood sugar go back to normal.,10,893
2254,the blood sugar drop in a body.,1,894
2255,cell in the pancrease release glucagon.,2,894
2256,the liver in response turn the glucagon into glucose.,3,894
2257,and release it into the blood.,4,894
2258,the blood sugar level be restore.,5,894
2259,oxygen - deplete blood enter the heart on the right atrium.,1,896
2260,the atrium contract.,2,896
2261,Blood flow from you right atrium into you right ventricle through the open tricuspid valve.,3,896
2262,"when the ventricle be full, the tricuspid valve shut.",4,896
2263,the ventricle contract.,5,896
2264,"Blood leave the heart through the pulmonic valve, into the pulmonary artery and to the lung.",6,896
2265,the lung oxygenate the blood.,7,896
2266,the oxygenated blood go into the left atrium.,8,896
2267,the left atrium send the blood throughout the body.,9,896
2268,the outer ear collect sound wafe.,1,900
2269,the sound wafe travel from the outer ear to the middle ear.,2,900
2270,the eardrum change the sound wafe into vibration.,3,900
2271,"the hammer, anvil, and stirrup bone vibrate.",4,900
2272,the sound move to the inner ear.,5,900
2273,the sound enter the liquid - fill cochlea.,6,900
2274,the cochlea vibrate.,7,900
2275,small hair in the cochlea move.,8,900
2276,nerve signal be create.,9,900
2277,the brain understand the nerve signal a sound.,10,900
2278,sound enter the ear of a person.,1,901
2279,the sound hit a drum that be inside the ear.,2,901
2280,the drum inside the ear convert the sound to electrical impulse.,3,901
2281,the electrical impulse be send to the brain.,4,901
2282,the brain can decode the impulse into sound.,5,901
2283,visible light enter through the lens.,1,903
2284,the light enter into the retina.,2,903
2285,the light be absorb by photoreceptor cell.,3,903
2286,which be turn into chemical energy.,4,903
2287,the result information be interpret by the brain a a image.,5,903
2288,the cornea and lens refract light into a small image.,1,904
2289,shine it on the retina.,2,904
2290,the retina 's rod and cone convert it to electrical pulse.,3,904
2291,the optic nerve carry electrical pulse through the optic canal.,4,904
2292,nerve fiber end in the lateral geniculate nucleu and the visual cortex.,5,904
2293,"the saliva break down the chemical in the food a bit, which help make the food mushy and easy to swallow.",1,905
2294,"you tongue help out, push the food around while you chew with you tooth.",2,905
2295,the esophagus move food from the back of you throat to you stomach.,3,905
2296,strong muscle in the wall of the stomach and gastric juice break down food in you stomach.,4,905
2297,you stomach move the food into the intestine to complete digestion.,5,905
2298,"when water freeze it become 10 % bigger, or take up 10 % more space.",1,908
2299,"a water expand it put great pressure on the wall of anything contain it, include any rock which happen to be surround it.",2,908
2300,"the force of the pressure exert on the rock surround it be enough to wedge the wall of the crack farther apart, thus expand and deepen the crack.",3,908
2301,clay expend when wet like ice do.,4,908
2302,this cause rock to break apart.,5,908
2303,some plant like moss and lichen be capable of grow without soil on bare rock.,6,908
2304,when they do this they root penetrate pore and crevice and cause rock to split apart a the root force they way down through the rock.,7,908
2305,sediment transport be the movement of solid particle ( sediment ).,1,915
2306,"the movement be due to a combination of gravity act on the sediment, and / or the movement of the fluid in which the sediment be entrain.",2,915
2307,"sediment transport occur in natural system where the particle be clastic rock ( sand, gravel, boulder, etc. ), mud, or clay.",3,915
2308,"the fluid be air, water, or ice.",4,915
2309,and the force of gravity act to move the particle along the sloping surface on which they be rest.,5,915
2310,"sediment transport due to fluid motion occur in river, ocean, lake, sea, and other body of water due to current and tide.",6,915
2311,Transport be also cause by glacier a they flow.,7,915
2312,sediment become loose from the rest of the soil.,1,916
2313,the sediment roll down hill towards a river.,2,916
2314,the heavy item sink to the bottom.,3,916
2315,the lighter item float on the top and in convection cycle.,4,916
2316,a the river flow the sediment be move.,5,916
2317,the sediment get dump through tributary into lake and the ocean.,6,916
2318,the sediment keep move around the world in convection current.,7,916
2319,energy build up in the crust of the earth.,1,917
2320,the energy cause the fault line give way.,2,917
2321,the earth 's plate move.,3,917
2322,the energy radiate outward from the fault in all direction.,4,917
2323,the seismic wafe shake the earth a they move through it.,5,917
2324,plate on the Earth 's crust move slowly past each other.,1,919
2325,"a the plate move, they exert a great force.",2,919
2326,"when the force be large enough, the crust break.",3,919
2327,the stress be release a energy.,4,919
2328,the energy move through the Earth in the form of wafe.,5,919
2329,we feel the earthquake.,6,919
2330,gase cause pressure beneath the earth.,1,920
2331,the gas come to a head and push molten magma to the surface.,2,920
2332,the magma cool.,3,920
2333,with enough time the pressure build up greatly.,4,920
2334,the result volcano may explode.,5,920
2335,Magma rise through crack in the Earth 's crust.,1,921
2336,the pressure cause plate to move.,2,921
2337,Magma explode to the surface.,3,921
2338,the lava from the eruption cool to form new crust.,4,921
2339,"after several eruption, the rock build up and a volcano form.",5,921
2340,Magma be form when rock melt inside the Earth 's crust.,1,922
2341,Magma rise.,2,922
2342,collect inside magma chamber underneath a volcano.,3,922
2343,pressure build in the magma chamber a they fill.,4,922
2344,gain energy for eruption.,5,922
2345,some of the energy be converted into seismic activity ( earthquake ).,6,922
2346,if the magma building in the volcano be thick and sticky it will trap gas.,7,922
2347,result in a explosive eruption when the pressure become too intense.,8,922
2348,if the magma be thin and run.,9,922
2349,"the magma result in a low - pressure, slow - move flow of magma instead of a violent eruption.",10,922
2350,Air be pull into the lung.,1,923
2351,oxygen move from the lung into the bloodstream.,2,923
2352,Air be push through the vocal chord.,3,923
2353,a person talk.,4,923
2354,other air be push out of the lung into the environment.,5,923
2355,you inhale.,1,924
2356,the air enter the mouth and nose.,2,924
2357,the diaphragm contract.,3,924
2358,Air fill all the sack in the lung.,4,924
2359,oxygen pas through the sack into capillary.,5,924
2360,the blood be pas to the blood in the capillary.,6,924
2361,the blood carry the oxygen to the heart.,7,924
2362,the heart pump the oxygenate blood to the body.,8,924
2363,he air we breathe contain oxygen and other gas.,1,925
2364,"once in the lung, oxygen be move into the bloodstream and carry through you body.",2,925
2365,"at each cell in you body, oxygen be exchange for a waste gas call carbon dioxide.",3,925
2366,you bloodstream then carry this waste gas back to the lung where it be remove from the blood stream and then exhale.,4,925
2367,"you lung and respiratory system automatically perform this vital process, call gas exchange.",5,925
2368,there be a lot of rain within a short period of time.,1,927
2369,the ground try to absorb a much rain water a it can.,2,927
2370,the ground become saturate with rain water and can not absorb anymore.,3,927
2371,Water begin flow above the ground instead of drop into the soil.,4,927
2372,"the water carve away land, plant, and tree.",5,927
2373,it cause destruction a it travel.,6,927
2374,a magma chamber form under the ground.,1,930
2375,a the magma get pressure it travel upwards.,2,930
2376,the magma find the weakest point in the volcano.,3,930
2377,the magma under pressure erupt through that point.,4,930
2378,the magma turn to lava in the air and travel down the volcano.,5,930
2379,Magma rise through surround rock.,1,931
2380,"gas bubble form and expand, cause lot of pressure.",2,931
2381,"this pressure push the magma through weak spot in the earth 's surface,.",3,931
2382,Magma flow out a lava.,4,931
2383,this can happen slowly or in a huge explosion.,5,931
